{
  "nomeLoja": "Mercado Bom Preço",
  "slogan": "Economia de verdade, produtos fresquinhos e atendimento de família!",
  "telefone": "(99) 9175-6968",
  "whatsapp": "559991756968",
  "endereco": "Rua das Flores, 123 - Centro",
  "cidadeBairro": "Bairro das Palmeiras - São Paulo, SP",
  "googleMapsUrl": "https://maps.google.com/?q=Mercado+Bom+Preco",
  "googleMapsEmbed": "https://www.google.com/maps/embed?pb=!1m18!1m12!1m3!1d3657.197587027958!2d-46.6543167!3d-23.5613476!2m3!1f0!2f0!3f0!3m2!1i1024!2i768!4f13.1!3m3!1m2!1s0x0%3A0x0!2zMjPCsDMzJzQwLjkiUyA0NsKwMzknMTUuNSJX!5e0!3m2!1spt-BR!2sbr!4v1600000000000",
  "horarioSemana": "Segunda a Sábado: 07h30 às 20h30",
  "horarioDomingo": "Domingos e Feriados: 08h00 às 13h30",
  "bannerAviso": "🎉 Feira de Frutas e Verduras frescas toda quarta e quinta com até 30% OFF!",
  "bannerTitulo": "Preço Baixo de Verdade para Sua Família",
  "bannerSubtitulo": "Frutas fresquinhas do dia, carnes nobres com corte na hora e tudo para a sua despensa pelo menor preço do bairro.",
  "chavePix": "559991756968",
  "tipoChavePix": "Celular / WhatsApp",
  "titularPix": "Mercado Bom Preço Ltda"
}
